|Theme|Sub-theme|Candidate|Proposition|Priority|Keywords|Data_origin|Data_source|Created_at|Updated_at
800| Finances publiques & Dette|    Economies & hausses des dépenses    | Jean Lassalle |Proposition non encore connue|-1||Programme|IFRAP|2022-03-31|2022-03-31
801| Finances publiques & Dette|    Economies & hausses des dépenses    | Marine Le Pen|Programme d'économie : sur l'immigration à hauteur de 18 milliards d’euros ; sur la lutte contre la fraude : 15 milliards ; sur la contribution de la France à l'Union européenne.|0||Programme|IFRAP|2022-03-31|2022-03-31
802| Finances publiques & Dette|    Economies & hausses des dépenses    | Emmanuel Macron|Proposition non encore connue|-1||Programme|IFRAP|2022-03-31|2022-03-31
803| Finances publiques & Dette|    Economies & hausses des dépenses    | Jean-Luc Mélenchon|Proposition non encore connue|-1||Programme|IFRAP|2022-03-31|2022-03-31
804| Finances publiques & Dette|    Economies & hausses des dépenses    | Philippe  Poutou |Proposition non encore connue|-1||Programme|IFRAP|2022-03-31|2022-03-31
805| Finances publiques & Dette|    Economies & hausses des dépenses    | Valérie Pécresse|Chiffre clé 45 Mds D'euros d'économies|1||Programme|IFRAP|2022-03-31|2022-03-31
806| Finances publiques & Dette|    Economies & hausses des dépenses    | Valérie Pécresse|Dès mai 2022, lancer une Opération Vérité sur le « quoi qu’il en coûte » afin de dresser un audit financier rigoureux des dépenses et de la dette et d’arrêter les dépenses inefficaces.|0||Programme|IFRAP|2022-03-31|2022-03-31
807| Finances publiques & Dette|    Economies & hausses des dépenses    | Valérie Pécresse|Réaliser 45 milliards d’euros d’économies grâce à ces réformes et percevoir 15 milliards d’euros de recettes supplémentaires par la privatisation d’entreprises concurrentielles dans lesquelles l’État n’a pas vocation à être un actionnaire minoritaire.|0||Programme|IFRAP|2022-03-31|2022-03-31
808| Finances publiques & Dette|    Economies & hausses des dépenses    | Fabien Roussel|Proposition non encore connue|-1||Programme|IFRAP|2022-03-31|2022-03-31
809| Finances publiques & Dette|    Economies & hausses des dépenses    | Eric Zemmour |Engager un grand processus de rationalisation et de baisse de la dépense publique en lançant, dès le lendemain de l’élection, un grand audit de la Cour des comptes sur toutes les politiques publiques |0||Programme|IFRAP|2022-03-31|2022-03-31
810| Finances publiques & Dette|    Privatisations/Nationalisations    | Nathalie Arthaud |Proposition non encore connue|-1||Programme|IFRAP|2022-03-31|2022-03-31
811| Finances publiques & Dette|    Privatisations/Nationalisations    | Nicolas  Dupont-Aignan|Renationalisation des autoroutes.|0||Programme|IFRAP|2022-03-31|2022-03-31
812| Finances publiques & Dette|    Privatisations/Nationalisations    | Anne Hidalgo|Proposition non encore connue|-1||Programme|IFRAP|2022-03-31|2022-03-31
813| Finances publiques & Dette|    Privatisations/Nationalisations    | Yannick Jadot|Proposition non encore connue|-1||Programme|IFRAP|2022-03-31|2022-03-31
814| Finances publiques & Dette|    Privatisations/Nationalisations    | Jean Lassalle |Nationaliser des entreprises clés pour l'économie par rachat de Bpifrance.|0||Programme|IFRAP|2022-03-31|2022-03-31
815| Finances publiques & Dette|    Privatisations/Nationalisations    | Marine Le Pen|Nationalisation des autoroutes : pour permettre de faire baisser de 10 à 15% les péages et un milliard et demi d’euros devraient également revenir dans le budget de l’Etat, pour permettre de financer une politique de réaménagement du territoire.|0||Programme|IFRAP|2022-03-31|2022-03-31
816| Finances publiques & Dette|    Privatisations/Nationalisations    | Marine Le Pen|Privatiser le service public audiovisuel, hors l’audiovisuel d’outre-mer et Arte.|0||Programme|IFRAP|2022-03-31|2022-03-31
817| Finances publiques & Dette|    Privatisations/Nationalisations    | Emmanuel Macron|Proposition non encore connue|-1||Programme|IFRAP|2022-03-31|2022-03-31
818| Finances publiques & Dette|    Privatisations/Nationalisations    | Jean-Luc Mélenchon|Revenir sur les privatisations (aéroports, autoroutes, Française des Jeux, etc).|0||Programme|IFRAP|2022-03-31|2022-03-31
819| Finances publiques & Dette|    Privatisations/Nationalisations    | Jean-Luc Mélenchon|Rendre effectif le droit de réquisition des usines et entreprises d'intérêt général par l'Etat.|0||Programme|IFRAP|2022-03-31|2022-03-31
820| Finances publiques & Dette|    Privatisations/Nationalisations    | Jean-Luc Mélenchon|Décréter un moratoire sur les partenariats publics-privés et abroger les dispositions législatives les permettant.|0||Programme|IFRAP|2022-03-31|2022-03-31
821| Finances publiques & Dette|    Privatisations/Nationalisations    | Jean-Luc Mélenchon|Créer une mission spéciale dressant le bilan des faveurs fiscales, des privatisations et des abandons de fleurons comme Alstom, Alcatel, EADS depuis 30 ans pour permettre la mise en examen et la détention préventive des suspects.|0||Programme|IFRAP|2022-03-31|2022-03-31
822| Finances publiques & Dette|    Privatisations/Nationalisations    | Philippe  Poutou |Nationalisation des forêts de plus de 20 ha.|0||Programme|IFRAP|2022-03-31|2022-03-31
823| Finances publiques & Dette|    Privatisations/Nationalisations    | Philippe  Poutou |Renationalisation des sociétés HLM.|0||Programme|IFRAP|2022-03-31|2022-03-31
824| Finances publiques & Dette|    Privatisations/Nationalisations    | Philippe  Poutou |Nationalisation de l’enseignement privé.|0||Programme|IFRAP|2022-03-31|2022-03-31
825| Finances publiques & Dette|    Privatisations/Nationalisations    | Valérie Pécresse|Céder toutes les participations minoritaires de l’Etat-actionnaire : 15 milliards d’euros de recettes de privatisation d’ici 2027.|0||Programme|IFRAP|2022-03-31|2022-03-31
826| Finances publiques & Dette|    Privatisations/Nationalisations    | Fabien Roussel|"Revenir aux nationalisations d'entreprises, ""un investissement sur le long terme"" : engager une réappropriation publique et sociale de la SNCF, d'EDF, d'Engie, de la Poste et de France Telecom."|0||Programme|IFRAP|2022-03-31|2022-03-31
827| Finances publiques & Dette|    Privatisations/Nationalisations    | Eric Zemmour |Privatisation du service public de l'audiovisuel.|0||Programme|IFRAP|2022-03-31|2022-03-31
828| Environnement & Energie|    Agriculture & PAC    | Nathalie Arthaud |Combattre l'élevage et l'abattage dont les abus sont la conséquence de l'économie capitaliste.|0||Programme|IFRAP|2022-03-31|2022-03-31
829| Environnement & Energie|    Agriculture & PAC    | Nathalie Arthaud |Interdiction de la chasse à courre.|0||Programme|IFRAP|2022-03-31|2022-03-31
830| Environnement & Energie|    Agriculture & PAC    | Nicolas  Dupont-Aignan|Renouer avec une vraie PAC et ses 3 volets : préférence communautaire, prix garantis et quotas ou mettre en oeuvre une politique agricole nationale. |0||Programme|IFRAP|2022-03-31|2022-03-31
831| Environnement & Energie|    Agriculture & PAC    | Nicolas  Dupont-Aignan|Instaurer et maintenir au sein d’un tunnel « maximum-minimum » des prix garantis pour les grandes productions agricoles telles que les céréales, le lait ou les viandes, grâce à une régulation adaptée des productions et des marchés. |0||Programme|IFRAP|2022-03-31|2022-03-31
832| Environnement & Energie|    Agriculture & PAC    | Nicolas  Dupont-Aignan|Exiger l’étiquetage obligatoire du pays d’origine des produits et renforcer la DGCCRF (Direction générale de la concurrence, de la consommation et de la répression des fraudes) pour mieux contrôler le respect des lois.|0||Programme|IFRAP|2022-03-31|2022-03-31
833| Environnement & Energie|    Agriculture & PAC    | Nicolas  Dupont-Aignan|Instaurer une exception agricole à l’OMC et dans tous les accords commerciaux sur le modèle de l’exception culturelle et rejeter l’accord UE / Mercosur et le CETA.|0||Programme|IFRAP|2022-03-31|2022-03-31
834| Environnement & Energie|    Agriculture & PAC    | Nicolas  Dupont-Aignan|Supprimer les cotisations sociales agricoles qui pèsent sur nos exploitations afin de rendre nos productions plus compétitives.|0||Programme|IFRAP|2022-03-31|2022-03-31
835| Environnement & Energie|    Agriculture & PAC    | Nicolas  Dupont-Aignan|Revaloriser de 30 % l’aide à la conversion à l’agriculture biologique (Soit une enveloppe de 48 millions d’€ pour l’Etat), aide qui doit arriver en temps et en heure.|0||Programme|IFRAP|2022-03-31|2022-03-31
836| Environnement & Energie|    Agriculture & PAC    | Nicolas  Dupont-Aignan|Restructurer la dette des agriculteurs surendettés en créant un fonds par lequel l’Etat serait prêteur en dernier ressort et inciter les banques à financer leurs projets. |0||Programme|IFRAP|2022-03-31|2022-03-31
837| Environnement & Energie|    Agriculture & PAC    | Anne Hidalgo|Faire adopter par le Parlement une loi de régulation, de partage et de protection du foncier agricole, et un plan décennal de renouvellement des générations.|0||Programme|IFRAP|2022-03-31|2022-03-31
838| Environnement & Energie|    Agriculture & PAC    | Anne Hidalgo|Poursuivre la revalorisation équitable des retraites agricoles. |0||Programme|IFRAP|2022-03-31|2022-03-31
839| Environnement & Energie|    Agriculture & PAC    | Anne Hidalgo|Renforcer l'agroécologie qui doit permettre un meilleur revenu des producteurs, par la diminution des dépenses d’intrants, une plus grande autonomie des exploitations, et la valorisation de la qualité des produits par une commercialisation collectivement maîtrisée par les producteurs. |0||Programme|IFRAP|2022-03-31|2022-03-31
840| Environnement & Energie|    Agriculture & PAC    | Anne Hidalgo|Mettre en œuvre des contrats de filière sur cinq ans avec l’industrie agroalimentaire, mesurés et évalués autour d’objectifs d’amélioration de la qualité alimentaire (réduction du sel, du gras, du sucre) et conduirons une grande clarification des labels et étiquetages pour donner aux citoyens le pouvoir de peser sur l’économie agricole et alimentaire. |0||Programme|IFRAP|2022-03-31|2022-03-31
841| Environnement & Energie|    Agriculture & PAC    | Anne Hidalgo|Travailler à la mise en œuvre d’une PAC plus juste et réellement verte, qui passera, à l’échelle nationale, par un soutien renforcé vers les petites et moyennes fermes avec beaucoup de main d’œuvre, et par des mesures agroenvironnementales et climatiques, c’est-à-dire des contrats de 5 ans pour l’accompagnement vers la transition qui incluront les aides au maintien et à la conversion vers l’agriculture biologique afin de mettre pleinement en œuvre la logique de reconnaissance pour services environnementaux. |0||Programme|IFRAP|2022-03-31|2022-03-31
842| Environnement & Energie|    Agriculture & PAC    | Yannick Jadot|Inderdition des néonicotinoïdes et le glyphosate dès 2022.|0||Programme|IFRAP|2022-03-31|2022-03-31
843| Environnement & Energie|    Agriculture & PAC    | Yannick Jadot|Imposer un moratoire sur les extensions et les nouvelles installations. D’ici à 2025, il n’y aura plus d’élevage industriel en France.|0||Programme|IFRAP|2022-03-31|2022-03-31
844| Environnement & Energie|    Agriculture & PAC    | Yannick Jadot|D'ici à 2030, 30% des fonds de la PAC seront destinés à approvisionner la restauration collective publique (écoles, universités, hôpitaux, établissements publics...) en produits 100 % bio, de qualité et de proximité. La TVA est supprimée sur les produits bio et de proximité pour rendre l’alimentation saine accessible à tous.|0||Programme|IFRAP|2022-03-31|2022-03-31
845| Environnement & Energie|    Agriculture & PAC    | Yannick Jadot|"""Nous préconisons l’autonomie en protéines : les importations de soja doivent cesser dans dix ans, pour mettre un terme à la déforestation importée et garantir notre souveraineté alimentaire. Nous soutenons la consommation de légumineuses et la réduction de la consommation des produits d’origine animale""."|0||Programme|IFRAP|2022-03-31|2022-03-31
846| Environnement & Energie|    Agriculture & PAC    | Jean Lassalle |Proposition non encore connue|-1||Programme|IFRAP|2022-03-31|2022-03-31
847| Environnement & Energie|    Agriculture & PAC    | Marine Le Pen|Garantir aux paysans des prix respectueux de leur travail et mettre un terme aux marges abusives de la grande distribution.|0||Programme|IFRAP|2022-03-31|2022-03-31
848| Environnement & Energie|    Agriculture & PAC    | Marine Le Pen|Interdire les importations de produits agricoles ne respectant pas les normes de production française.|0||Programme|IFRAP|2022-03-31|2022-03-31
849| Environnement & Energie|    Agriculture & PAC    | Marine Le Pen|Contraindre les cantines à utiliser 80% de produits agricoles français.|0||Programme|IFRAP|2022-03-31|2022-03-31
850| Environnement & Energie|    Agriculture & PAC    | Marine Le Pen|Mettre en place un « plan abattoirs » pour assurer des conditions dignes et interdire l’abattage sans étourdissement.|0||Programme|IFRAP|2022-03-31|2022-03-31
851| Environnement & Energie|    Agriculture & PAC    | Marine Le Pen|Généraliser l’étiquetage sur l’origine et la qualité des produits alimentaires.|0||Programme|IFRAP|2022-03-31|2022-03-31
852| Environnement & Energie|    Agriculture & PAC    | Emmanuel Macron|Une loi d’orientation et d’avenir pour assurer le renouvellement des générations, la formation et l’installation des jeunes agriculteurs.|0||Programme|IFRAP|2022-03-31|2022-03-31
853| Environnement & Energie|    Agriculture & PAC    | Jean-Luc Mélenchon|Créer 300 000 agricoles en instaurant une agriculture relocalisée, diversifiée et écologique.|0||Programme|IFRAP|2022-03-31|2022-03-31
854| Environnement & Energie|    Agriculture & PAC    | Jean-Luc Mélenchon|Garantir des prix rémunérateurs aux producteurs par des prix planchers pour les agriculteurs, interdire les ventes à perte et mettre en place une caisse de défaisance pour reprendre les dettes agricoles des convertis au 100% bio.|0||Programme|IFRAP|2022-03-31|2022-03-31
855| Environnement & Energie|    Agriculture & PAC    | Jean-Luc Mélenchon|Refondre la PAC et orienter les aides publiques agricoles pour favoriser la production écologiquement soutenable, l'intensité en main-d'oeuvre des exploitations et le développement des protéines végétales.|0||Programme|IFRAP|2022-03-31|2022-03-31
856| Environnement & Energie|    Agriculture & PAC    | Jean-Luc Mélenchon|Faire une réforme agraire pour encourager l'installation de nouveaux agriculteurs et permettre le développement d'un tissu de nombreuses exploitations à taille humaine.|0||Programme|IFRAP|2022-03-31|2022-03-31
857| Environnement & Energie|    Agriculture & PAC    | Jean-Luc Mélenchon|Planifier la réduction progressive des doses d'engrais et de pesticides, interdire immédiatement les plus dangeureux (glyphosate, etc).|0||Programme|IFRAP|2022-03-31|2022-03-31
858| Environnement & Energie|    Agriculture & PAC    | Jean-Luc Mélenchon|Instaurer un protectionnisme écologique en fonction des conditions de production et de rémunération du travail agricole.|0||Programme|IFRAP|2022-03-31|2022-03-31
859| Environnement & Energie|    Agriculture & PAC    | Jean-Luc Mélenchon|Encadrer les prix alimentaires par des prix maximaux établis par un coefficient multiplicateur et limiter le smarges de la grande distribution.|0||Programme|IFRAP|2022-03-31|2022-03-31
860| Environnement & Energie|    Agriculture & PAC    | Jean-Luc Mélenchon|"Développer les circuits courts pour réduire la circulation des marchandises et l""utilisation d'emballages."|0||Programme|IFRAP|2022-03-31|2022-03-31
861| Environnement & Energie|    Agriculture & PAC    | Jean-Luc Mélenchon|Porter l'alimentation dans la restauration collective à 100% biologique et locale, réduire la part des protéines carnées au profit des protéines végétales et y imposer une option végétarienne quotidienne.|0||Programme|IFRAP|2022-03-31|2022-03-31
862| Environnement & Energie|    Agriculture & PAC    | Jean-Luc Mélenchon|Arrêter les activités dangeureuses pour la santé et l'environnement (comme les engrais à base de nitrate d'ammonium) et planifier la reconversion des travailleurs.|0||Programme|IFRAP|2022-03-31|2022-03-31
863| Environnement & Energie|    Agriculture & PAC    | Jean-Luc Mélenchon|Interdire les fermes-usines et tous les élevaes de production de fourrure et ce, immédiatement pour les élevages de visons.|0||Programme|IFRAP|2022-03-31|2022-03-31
864| Environnement & Energie|    Agriculture & PAC    | Jean-Luc Mélenchon|Interdire les pratiques de chasse.|0||Programme|IFRAP|2022-03-31|2022-03-31
865| Environnement & Energie|    Agriculture & PAC    | Philippe  Poutou |Interdiction des intrants chimiques.|0||Programme|IFRAP|2022-03-31|2022-03-31
866| Environnement & Energie|    Agriculture & PAC    | Philippe  Poutou |Développement des circuits courts : aides aux filières autogérées et aux coopératives.|0||Programme|IFRAP|2022-03-31|2022-03-31
867| Environnement & Energie|    Agriculture & PAC    | Philippe  Poutou |Vers le tout biologique sur 10 ans.|0||Programme|IFRAP|2022-03-31|2022-03-31
868| Environnement & Energie|    Agriculture & PAC    | Philippe  Poutou |En finir avec l’élevage industriel, maltraitant pour les animaux et les salarié·e·s.|0||Programme|IFRAP|2022-03-31|2022-03-31
869| Environnement & Energie|    Agriculture & PAC    | Philippe  Poutou |Moratoire sur les dettes des agriculteurs·trices.|0||Programme|IFRAP|2022-03-31|2022-03-31
870| Environnement & Energie|    Agriculture & PAC    | Philippe  Poutou |Fonds public d’acquisition de foncier pour l’installation en coopérative de jeunes agriculteurs·trices.|0||Programme|IFRAP|2022-03-31|2022-03-31
871| Environnement & Energie|    Agriculture & PAC    | Valérie Pécresse|Taxer les importations ne respectant pas les normes françaises.|0||Programme|IFRAP|2022-03-31|2022-03-31
872| Environnement & Energie|    Agriculture & PAC    | Valérie Pécresse|Durcir la PAC.|0||Programme|IFRAP|2022-03-31|2022-03-31
873| Environnement & Energie|    Agriculture & PAC    | Valérie Pécresse|Accroître les surfaces agricoles biologiques.|0||Programme|IFRAP|2022-03-31|2022-03-31
874| Environnement & Energie|    Agriculture & PAC    | Valérie Pécresse|Dynamiser le développement des produits locaux.|0||Programme|IFRAP|2022-03-31|2022-03-31
875| Environnement & Energie|    Agriculture & PAC    | Valérie Pécresse|Placer les intérêts agricoles au cœur des négociations commerciales européennes.|0||Programme|IFRAP|2022-03-31|2022-03-31
876| Environnement & Energie|    Agriculture & PAC    | Valérie Pécresse|Aider les agriculteurs à obtenir des prix rémunérateurs en favorisant leur regroupement et la contractualisation.|0||Programme|IFRAP|2022-03-31|2022-03-31
877| Environnement & Energie|    Agriculture & PAC    | Valérie Pécresse|Aider les agriculteurs à obtenir des prix rémunérateurs en favorisant leur montée en gamme.|0||Programme|IFRAP|2022-03-31|2022-03-31
878| Environnement & Energie|    Agriculture & PAC    | Valérie Pécresse|Adopter une politique alimentaire européenne en ligne avec nos impératifs agricoles.|0||Programme|IFRAP|2022-03-31|2022-03-31
879| Environnement & Energie|    Agriculture & PAC    | Valérie Pécresse|Encourager la diversification des exploitations et mieux rémunérer la multifonctionnalité de l’agriculture, notamment dans le domaine environnemental.|0||Programme|IFRAP|2022-03-31|2022-03-31
880| Environnement & Energie|    Agriculture & PAC    | Valérie Pécresse|Réduire l’impact des fluctuations de marché sur le revenu des agriculteurs, en développant notamment le recours aux assurances.|0||Programme|IFRAP|2022-03-31|2022-03-31
881| Environnement & Energie|    Agriculture & PAC    | Valérie Pécresse|Revaloriser les retraites agricoles.|0||Programme|IFRAP|2022-03-31|2022-03-31
882| Environnement & Energie|    Agriculture & PAC    | Valérie Pécresse|Baisser le niveau de la taxe foncière sur le non bâti en augmentant l’abattement forfaitaire sur les terres agricoles de 20% à 50% pour améliorer la compétitivité des exploitations. Baisser d’un tiers, dès 2022, les cotisations vieillesse pour augmenter le revenu des agriculteurs.|0||Programme|IFRAP|2022-03-31|2022-03-31
883| Environnement & Energie|    Agriculture & PAC    | Valérie Pécresse|Mettre fin au dumping réglementaire et environnemental.|0||Programme|IFRAP|2022-03-31|2022-03-31
884| Environnement & Energie|    Agriculture & PAC    | Valérie Pécresse|Réduire l’impact des fluctuations de marché sur le revenu des agriculteurs, en développant notamment le recours aux assurances.|0||Programme|IFRAP|2022-03-31|2022-03-31
885| Environnement & Energie|    Agriculture & PAC    | Valérie Pécresse|Défendre la taxe carbone aux frontières de l’Europe pour que notre agriculture ne soit pas soumise à une concurrence déloyale de la part de pays qui ne respectent pas la même discipline écologique.|0||Programme|IFRAP|2022-03-31|2022-03-31
886| Environnement & Energie|    Agriculture & PAC    | Valérie Pécresse|Réviser, dès les 6 premiers mois du mandat, tout le stock de la réglementation française existante issue du cadre agricole européen.|0||Programme|IFRAP|2022-03-31|2022-03-31
887| Environnement & Energie|    Agriculture & PAC    | Valérie Pécresse|D'ici 2027, les repas servis dans toutes les cantines publiques (écoles, hôpitaux, administrations…) devront utiliser au moins 50 % de produits issus d’un approvisionnement local ou bénéficiant d’un label comme l'agriculture biologique, lapêche durable.|0||Programme|IFRAP|2022-03-31|2022-03-31
888| Environnement & Energie|    Agriculture & PAC    | Fabien Roussel|Une loi d’orientation et de programmation agricole sera soumise à la représentation nationale Elle aura pour objectifs de garantir des prix de base rémunérateurs du travail paysan, tout en contenant les prix des produits industriels nécessaires à la production, de lancer un programme de moyen terme d’installation de jeunes paysans-travailleurs vivant convenablement sans être contraints d’agrandir sans cesse leurs exploitations pour tenter de s’assurer un revenu.|0||Programme|IFRAP|2022-03-31|2022-03-31
889| Environnement & Energie|    Agriculture & PAC    | Fabien Roussel|Combattre les insupportables inégalités d’aides au revenu en soutenant prioritairement les 60 premiers hectares. Les aides seront dégressives pour être plafonnées à 150 000 euros par exploitation. Elles pourront être augmentées se- 60 61 lon des conditionnalités environnementales et pour les fermes en agriculture biologique. Au-delà, il s’agira de remplacer le système d’aide à l’hectare par une aide à l’actif agricole.|0||Programme|IFRAP|2022-03-31|2022-03-31
890| Environnement & Energie|    Agriculture & PAC    | Eric Zemmour |Faire en sorte que la grande distribution ne puisse plus imposer ses prix aux producteurs en mettant fin aux regroupements de plusieurs enseignes au sein de centrales d’achat communes . |0||Programme|IFRAP|2022-03-31|2022-03-31
891| Environnement & Energie|    Agriculture & PAC    | Eric Zemmour |Interdire l'importation de produits agricoles non conformes à nos standards de qualité.|0||Programme|IFRAP|2022-03-31|2022-03-31
892| Environnement & Energie|    Agriculture & PAC    | Eric Zemmour |Financer l'innovation en robotique agricole.|0||Programme|IFRAP|2022-03-31|2022-03-31
893| Environnement & Energie|    Agriculture & PAC    | Eric Zemmour |Favoriser le renouvellement des générations en augmentant la dotation jeunes agriculteurs et en simplifiant les procédures. Encourager l'installation de nouveaux producteurs notamment dans la culture bio.|0||Programme|IFRAP|2022-03-31|2022-03-31
894| Environnement & Energie|    Agriculture & PAC    | Eric Zemmour |Privilégier les circuits courts en augmentant la part de produits locaux dans la restauration collective en entreprise et dans les écoles|0||Programme|IFRAP|2022-03-31|2022-03-31
895| Environnement & Energie|    Agriculture & PAC    | Eric Zemmour | Ne plus accabler de contraintes les paysans français en interdisant la surtransposition dans notre droit des normes européennes |0||Programme|IFRAP|2022-03-31|2022-03-31
896| Environnement & Energie|    Agriculture & PAC    | Eric Zemmour |Indiquer sur tous les produits contenant de la viande le mode d’abattage des animaux (conventionnel avec étourdissement ou rituel sans étourdissement)|0||Programme|IFRAP|2022-03-31|2022-03-31
897| Environnement & Energie|    Ecologie & lutte contre la pollution    | Nathalie Arthaud |Proposition non encore connue|-1||Programme|IFRAP|2022-03-31|2022-03-31
898| Environnement & Energie|    Ecologie & lutte contre la pollution    | Nicolas  Dupont-Aignan|Développement des circuits-courts dans l’alimentation et l’approvisionnement des cantines scolaires, et interdiction massive des perturbateurs endocriniens.|0||Programme|IFRAP|2022-03-31|2022-03-31
899| Environnement & Energie|    Ecologie & lutte contre la pollution    | Nicolas  Dupont-Aignan|Interdiction des produits obsolescents et lancement d’un programme zéro déchets sur 10 ans pour nos océans.|0||Programme|IFRAP|2022-03-31|2022-03-31
900| Environnement & Energie|    Ecologie & lutte contre la pollution    | Anne Hidalgo|Développement d'un plan sur 5 ans pour décarbonner l'économie.|0||Programme|IFRAP|2022-03-31|2022-03-31
