|Theme|Sub-theme|Candidate|Proposition|Priority|Keywords|Data_origin|Data_source|Created_at|Updated_at
1193| Intérieur, Défense & Justice|    Justice & pénitentiaire    | Jean-Luc Mélenchon|Renforcer les droits de la défense, inscrire le droit à une défense dans la Constitution et garantir la gratuité des procédures les plus courantes (le divorce, par ex)|0||Programme|IFRAP|2022-03-31|2022-03-31
1194| Intérieur, Défense & Justice|    Justice & pénitentiaire    | Jean-Luc Mélenchon|Renforcer l'indépendance de la justice vis-à-vis de l'exécutif : interdire les instructions individuelles sauf lorsqu'elles appellent à une intervention directe de l'exécutif en matière d'ordre public (terrorisme, par ex).|0||Programme|IFRAP|2022-03-31|2022-03-31
1195| Intérieur, Défense & Justice|    Justice & pénitentiaire    | Jean-Luc Mélenchon|Poursuivre et punir tous les complices de violation du secret de l'instruction.|0||Programme|IFRAP|2022-03-31|2022-03-31
1196| Intérieur, Défense & Justice|    Justice & pénitentiaire    | Jean-Luc Mélenchon|Doubler les effectifs des services qui luttent contre les infractions financières, supprimer réellement le verrou de Bercy et supprimer la convention judiciaire d'intérêt public.|0||Programme|IFRAP|2022-03-31|2022-03-31
1197| Intérieur, Défense & Justice|    Justice & pénitentiaire    | Philippe  Poutou |Généralisation des alternatives à la prison.|0||Programme|IFRAP|2022-03-31|2022-03-31
1198| Intérieur, Défense & Justice|    Justice & pénitentiaire    | Philippe  Poutou |Application du code du travail pour les prisonniers.ères.|0||Programme|IFRAP|2022-03-31|2022-03-31
1199| Intérieur, Défense & Justice|    Justice & pénitentiaire    | Philippe  Poutou |Légalisation du cannabis et dépénalisation de la consommation des drogues.|0||Programme|IFRAP|2022-03-31|2022-03-31
1200| Intérieur, Défense & Justice|    Justice & pénitentiaire    | Philippe  Poutou |Amnistie pour les prisonniers politiques.|0||Programme|IFRAP|2022-03-31|2022-03-31
1201| Intérieur, Défense & Justice|    Justice & pénitentiaire    | Valérie Pécresse|Chiffre clé 20 000 places De prisons supplémentaires.|1||Programme|IFRAP|2022-03-31|2022-03-31
1202| Intérieur, Défense & Justice|    Justice & pénitentiaire    | Valérie Pécresse|Doubler le nombre de centres éducatifs fermés pour les mineurs et ouvrir à terme 20 000 places de prison.|0||Programme|IFRAP|2022-03-31|2022-03-31
1203| Intérieur, Défense & Justice|    Justice & pénitentiaire    | Valérie Pécresse|Déjudiciariser des contentieux de masse qui saturent les audiences pour recentrer la justice sur les dossiers prioritaires. Et simplifier la procédure pénale, notamment pour réduire massivement les délais de jugement.|0||Programme|IFRAP|2022-03-31|2022-03-31
1204| Intérieur, Défense & Justice|    Justice & pénitentiaire    | Valérie Pécresse|Augmenter de plus de 50 % sur 5 ans les moyens des tribunaux pour les porter à 9 milliards par an. Augmenter de plus de 50 % le nombre de magistrats (3 000 juges et 2 000 procureurs en plus) et recruterai 3 000 greffiers, 5 000 juristes assistants et 3 000 personnels techniques. Pour accélérer ces 16 000 recrutements, ils seront ouverts aux professionnels du droit ayant 15 ans d’expérience et aux cadres de la police et de la gendarmerie|0||Programme|IFRAP|2022-03-31|2022-03-31
1205| Intérieur, Défense & Justice|    Justice & pénitentiaire    | Valérie Pécresse|Consacrer jusqu’à 1,8 milliard par an pour mettre à la disposition de la justice des locaux, des équipements et des moyens informatiques performants.|0||Programme|IFRAP|2022-03-31|2022-03-31
1206| Intérieur, Défense & Justice|    Justice & pénitentiaire    | Valérie Pécresse|Permettre des jugements rendus en moins de 6 mois – appels compris – pour toutes les violences et les délits du quotidien afin de mettre un terme au sentiment d’impunité légitimement répandu.|0||Programme|IFRAP|2022-03-31|2022-03-31
1207| Intérieur, Défense & Justice|    Justice & pénitentiaire    | Valérie Pécresse|Systématiser les comparutions immédiates ou à délai rapproché pour les flagrants délits et accélérer les délais de jugement dans le cadre de grands projets d’infrastructures afin de ne pas faire dépendre la réalisation de ces projets d’intérêt public de l’issue de longue procédures juridictionnelles.|0||Programme|IFRAP|2022-03-31|2022-03-31
1208| Intérieur, Défense & Justice|    Justice & pénitentiaire    | Valérie Pécresse|Créer dans les 6 mois suivant l’élection des centres correctionnels fermés, avec incarcération de détenus sous bracelet électronique pour assurer l’exécution des courtes peines.|0||Programme|IFRAP|2022-03-31|2022-03-31
1209| Intérieur, Défense & Justice|    Justice & pénitentiaire    | Valérie Pécresse|Assurer l’exécution des peines dans les 3 mois, que ce soient les travaux d’intérêt général ou les peines de prison.|0||Programme|IFRAP|2022-03-31|2022-03-31
1210| Intérieur, Défense & Justice|    Justice & pénitentiaire    | Valérie Pécresse|Généraliser les retenues sur salaires et prestations sociales pour lutter contre les amendes impayées, il faut généraliser les. Les délinquants doivent être frappés au portefeuille comme cela a été expérimenté en Ile-de-France.|0||Programme|IFRAP|2022-03-31|2022-03-31
1211| Intérieur, Défense & Justice|    Justice & pénitentiaire    | Valérie Pécresse|Les violences intrafamiliales, et en particulier les violences conjugales, seront instruites en 72 heures et jugées en 15 jours.|0||Programme|IFRAP|2022-03-31|2022-03-31
1212| Intérieur, Défense & Justice|    Justice & pénitentiaire    | Valérie Pécresse|Abaisser la majorité pénale à 16 ans.|0||Programme|IFRAP|2022-03-31|2022-03-31
1213| Intérieur, Défense & Justice|    Justice & pénitentiaire    | Valérie Pécresse|Instaurer des peines plancher (un an de prison ferme) contre tous ceux qui s’en prennent aux forces de l’ordre et à toute personne dépositaire de l’autorité publique|0||Programme|IFRAP|2022-03-31|2022-03-31
1214| Intérieur, Défense & Justice|    Justice & pénitentiaire    | Valérie Pécresse|Faire en sorte qu’un Officier de Police Judiciaire, quel que soit son grade, puisse devenir magistrat.|0||Programme|IFRAP|2022-03-31|2022-03-31
1215| Intérieur, Défense & Justice|    Justice & pénitentiaire    | Valérie Pécresse|Mettre en place une taxe de tribunal pour l’accès des entreprises à la justice civile et commerciale, comme dans la plupart des pays européens. Seules les entreprises installées d’une certaine taille y seraient assujetties. Ces sommes abonderont le budget de l’aide juridictionnelle.|0||Programme|IFRAP|2022-03-31|2022-03-31
1216| Intérieur, Défense & Justice|    Justice & pénitentiaire    | Valérie Pécresse|Déjudiciariser les contentieux de masse (tutelle, surendettement, loyers impayés…) pour permettre aux magistrats de se recentrer sur leur coeur de métier et de traiter les dossiers prioritaires. Et généraliser des procédures rapides d’injonction de payer pour toutes les factures, loyers ou créances impayés. Juger les délits du quotidien en moins de six mois et généraliser les comparutions immédiates en cas de flagrants délits car, pour être efficace, la réponse pénale doitêtre rapide.|0||Programme|IFRAP|2022-03-31|2022-03-31
1217| Intérieur, Défense & Justice|    Justice & pénitentiaire    | Valérie Pécresse|Instaurer un délit pénal de non-exécution des décisions de justice civiles définitives.|0||Programme|IFRAP|2022-03-31|2022-03-31
1218| Intérieur, Défense & Justice|    Justice & pénitentiaire    | Fabien Roussel|La justice et l'accompagnement des mineurs seront dotés de 25 000 magistrats, éducatrices et éducateurs.|0||Programme|IFRAP|2022-03-31|2022-03-31
1219| Intérieur, Défense & Justice|    Justice & pénitentiaire    | Eric Zemmour |Chiffre clé 10 000 Nouvelles places de prison et libération de 10 000 places via des expulsions|1||Programme|IFRAP|2022-03-31|2022-03-31
1220| Intérieur, Défense & Justice|    Justice & pénitentiaire    | Eric Zemmour |Obliger les juges à sanctionner tous les délinquants et criminels en introduisant des peines planchers pour tous les crimes et délits. Appliquer réellement les condamnations en mettant fin aux aménagements de peine et mettre hors d’état de nuire les criminels les plus dangereux et les terroristes en rétablissant une peine de perpétuité réelle non-compressible|0||Programme|IFRAP|2022-03-31|2022-03-31
1221| Intérieur, Défense & Justice|    Justice & pénitentiaire    | Eric Zemmour |Déchoir de la nationalité française les criminels et les délinquants multirécidivistes binationaux puis les expulser.|0||Programme|IFRAP|2022-03-31|2022-03-31
1222| Intérieur, Défense & Justice|    Justice & pénitentiaire    | Eric Zemmour |Recruter 3 000 magistrats et 3 000 greffiers.|0||Programme|IFRAP|2022-03-31|2022-03-31
1223| Intérieur, Défense & Justice|    Justice & pénitentiaire    | Eric Zemmour |Abaisser l'âge de la majorité pénale de 18 à 16 ans et donner la possibilité aux juges d’écarter l’excuse de minorité (qui réduit de moitié la peine) pour les mineurs de 13 à 15 ans pour sanctionner tous les crimes graves|0||Programme|IFRAP|2022-03-31|2022-03-31
1224| Intérieur, Défense & Justice|    Justice & pénitentiaire    | Eric Zemmour |Expulser immédiatement tous les délinquants étrangers incarcérés, pour libérer au moins 10000 places de prison et construire 10000 places de prison supplémentaires sur le mandat en simplifiant le processus administratif, pour redonner à la Justice les moyens de punir ceux qui le méritent|0||Programme|IFRAP|2022-03-31|2022-03-31
1225| Intérieur, Défense & Justice|    Justice & pénitentiaire    | Eric Zemmour |Retrouver une procédure pénale rapide et efficace en simplifiant drastiquement le code de procédure pénale dans la lignée de la tradition inquisitoire française|0||Programme|IFRAP|2022-03-31|2022-03-31
1226| Intérieur, Défense & Justice|    Justice & pénitentiaire    | Eric Zemmour |Empêcher certains juges de ressusciter le délit politique et le délit d’opinion en abrogeant la loi Pleven pour revenir à la loi de 1881 sur la liberté de la presse qui sanctionnait déjà l’injure, la diffamation et la provocation à certains crimes et délits|0||Programme|IFRAP|2022-03-31|2022-03-31
1227| Intérieur, Défense & Justice|    Justice & pénitentiaire    | Eric Zemmour |Abroger la loi « contre la manipulation de l’information » du 22 décembre 2018 qui menace les libertés publiques et revenir au cadre juridique précédent qui prévoyait déjà un « délit de fausse nouvelle »|0||Programme|IFRAP|2022-03-31|2022-03-31
1228| Intérieur, Défense & Justice|    Sécurité intérieure, police & terrorisme    | Nathalie Arthaud |Proposition non encore connue|-1||Programme|IFRAP|2022-03-31|2022-03-31
1229| Intérieur, Défense & Justice|    Sécurité intérieure, police & terrorisme    | Nicolas  Dupont-Aignan|Ouverture d’un bagne aux îles Kerguelen réservé aux condamnés pour faits de terrorisme.|0||Programme|IFRAP|2022-03-31|2022-03-31
1230| Intérieur, Défense & Justice|    Sécurité intérieure, police & terrorisme    | Nicolas  Dupont-Aignan|Déchéance de nationalité pour les binationaux condamnés pour terrorisme.|0||Programme|IFRAP|2022-03-31|2022-03-31
1231| Intérieur, Défense & Justice|    Sécurité intérieure, police & terrorisme    | Anne Hidalgo|Répondre aux besoins de sécurité du quotidien (petite délinquance, incivilités, harcèlement de rue) tout en luttant plus efficacement contre la criminalité organisée (trafics de drogue, proxénétisme, cybercriminalité).|0||Programme|IFRAP|2022-03-31|2022-03-31
1232| Intérieur, Défense & Justice|    Sécurité intérieure, police & terrorisme    | Anne Hidalgo|Créer des unités de police et magistrats dédiées aux violences faites aux femmes.|0||Programme|IFRAP|2022-03-31|2022-03-31
1233| Intérieur, Défense & Justice|    Sécurité intérieure, police & terrorisme    | Anne Hidalgo|Tout recrutement s’accompagnera d’un budget d’équipement et en immobilier pour améliorer les conditions de vie et de travail des policiers et gendarmes.|0||Programme|IFRAP|2022-03-31|2022-03-31
1234| Intérieur, Défense & Justice|    Sécurité intérieure, police & terrorisme    | Anne Hidalgo|La création d’une police municipale ne donnera plus lieu au désengagement de la police nationale, mais permettra à chacune des forces de se concentrer sur ses missions prioritaires, en complémentarité et dans une logique de service public.|0||Programme|IFRAP|2022-03-31|2022-03-31
1235| Intérieur, Défense & Justice|    Sécurité intérieure, police & terrorisme    | Yannick Jadot|Lancement d'une conférence de respect et de confiance entre la police et les citoyen-ne-s pour poser les éléments d’une loi de programmation pour doter les forces de l’ordre des moyens nécessaires à leur action, adapter l’organisation administrative et rétablir des doctrines de maintien de l’ordre conformes aux traditions républicaines.|0||Programme|IFRAP|2022-03-31|2022-03-31
1236| Intérieur, Défense & Justice|    Sécurité intérieure, police & terrorisme    | Yannick Jadot|L'inspection générale de la police nationale (IGPN) sera placée sous la compétence du-de la défenseur-e des droits.|0||Programme|IFRAP|2022-03-31|2022-03-31
1237| Intérieur, Défense & Justice|    Sécurité intérieure, police & terrorisme    | Jean Lassalle |Recruter, sur le mandat, 6 000 gendarmes et policiers. Ouvrir 2 000 bureaux et police et de gendarmerie. |0||Programme|IFRAP|2022-03-31|2022-03-31
1238| Intérieur, Défense & Justice|    Sécurité intérieure, police & terrorisme    | Marine Le Pen|Chiffre clé 7 000 Recrutement de policiers et gendarmes|1||Programme|IFRAP|2022-03-31|2022-03-31
1239| Intérieur, Défense & Justice|    Sécurité intérieure, police & terrorisme    | Marine Le Pen|Voter tous les 5 ans une loi de programmation pour la sécurité.|0||Programme|IFRAP|2022-03-31|2022-03-31
1240| Intérieur, Défense & Justice|    Sécurité intérieure, police & terrorisme    | Marine Le Pen|Flécher une partie des investissements d’avenir (5 %) vers le secteur de la sécurité.|0||Programme|IFRAP|2022-03-31|2022-03-31
1241| Intérieur, Défense & Justice|    Sécurité intérieure, police & terrorisme    | Marine Le Pen|Lancer des investissements matériels (véhicules, hélicoptères, etc.). Doter la police de véhicules à haute protection.|0||Programme|IFRAP|2022-03-31|2022-03-31
1242| Intérieur, Défense & Justice|    Sécurité intérieure, police & terrorisme    | Marine Le Pen|Créer 7 000 postes de policiers et de gendarmes et créer des unités d’intervention à résidence pour la gendarmerie outre-mer. Renforcer en effectifs (+1 000 agents) l’Office central antistupéfiants. Doubler le nombre de brigades cynophiles (PAF, PJ et douanes). Recruter 3 000 agents administratifs pour les contrôles fixes transfrontières (sous l’autorité de la PAF) afin de redéployer autant d’agents de la PAF vers leur cœur de métier.|0||Programme|IFRAP|2022-03-31|2022-03-31
1243| Intérieur, Défense & Justice|    Sécurité intérieure, police & terrorisme    | Marine Le Pen|Créer une école de formation des policiers municipaux.|0||Programme|IFRAP|2022-03-31|2022-03-31
1244| Intérieur, Défense & Justice|    Sécurité intérieure, police & terrorisme    | Marine Le Pen|Rendre obligatoire la mise en place d’une police municipale dans les villes de plus de 10000 habitants.|0||Programme|IFRAP|2022-03-31|2022-03-31
1245| Intérieur, Défense & Justice|    Sécurité intérieure, police & terrorisme    | Marine Le Pen|Obligation d'armer la police municipale dans les villes de plus de 10 000 habitants.|0||Programme|IFRAP|2022-03-31|2022-03-31
1246| Intérieur, Défense & Justice|    Sécurité intérieure, police & terrorisme    | Emmanuel Macron|15 milliards d'euros supplémentaires sur cinq ans.|0||Programme|IFRAP|2022-03-31|2022-03-31
1247| Intérieur, Défense & Justice|    Sécurité intérieure, police & terrorisme    | Emmanuel Macron|Achever le doublement de la présence des forces de l’ordre sur la voie publique et le déploiement de 200 nouvelles brigades pour plus de gendarmes en ruralité.|0||Programme|IFRAP|2022-03-31|2022-03-31
1248| Intérieur, Défense & Justice|    Sécurité intérieure, police & terrorisme    | Emmanuel Macron|Mettre en oeuvre le doublement de la présence des forces de l’ordre dans les transports aux moments critiques et le triplement de l’amende contre le harcèlement de rue, pour la sécurité des femmes.|0||Programme|IFRAP|2022-03-31|2022-03-31
1249| Intérieur, Défense & Justice|    Sécurité intérieure, police & terrorisme    | Emmanuel Macron|Constituer une Force d’action républicaine (forces de sécurité, magistrats, équipes éducatives, etc.) pour rétablir en urgence l’ordre dans les quartiers en crise.|0||Programme|IFRAP|2022-03-31|2022-03-31
1250| Intérieur, Défense & Justice|    Sécurité intérieure, police & terrorisme    | Emmanuel Macron|Faciliter le dialogue entre police, gendarmerie et population sur les priorités de sécurité de proximité, notamment par messageries instantanées.|0||Programme|IFRAP|2022-03-31|2022-03-31
1251| Intérieur, Défense & Justice|    Sécurité intérieure, police & terrorisme    | Emmanuel Macron|Mise en oeuvre du recrutement de 1 500 cyberpatrouilleurs.|0||Programme|IFRAP|2022-03-31|2022-03-31
1252| Intérieur, Défense & Justice|    Sécurité intérieure, police & terrorisme    | Jean-Luc Mélenchon|Abroger les lois sécuritaires inefficaces et renforcer les logiques de prévention.|-2||Programme|IFRAP|2022-03-31|2022-03-31
1253| Intérieur, Défense & Justice|    Sécurité intérieure, police & terrorisme    | Jean-Luc Mélenchon|Renforcer les moyens humains du renseignement en revenant sur la fusion de la direction de la surveillance du territoire (DST) et des renseignements généraux (RG), et privilégier l’infiltration au mirage du tout-technologique.|0||Programme|IFRAP|2022-03-31|2022-03-31
1254| Intérieur, Défense & Justice|    Sécurité intérieure, police & terrorisme    | Jean-Luc Mélenchon|Lutter contre l’embrigadement et soutenir les programmes de prise en charge des personnes suspectées.|0||Programme|IFRAP|2022-03-31|2022-03-31
1255| Intérieur, Défense & Justice|    Sécurité intérieure, police & terrorisme    | Jean-Luc Mélenchon|Démanteler les BAC (Brigades Anti-criminalité) et réhabiliter la police de proximité.|0||Programme|IFRAP|2022-03-31|2022-03-31
1256| Intérieur, Défense & Justice|    Sécurité intérieure, police & terrorisme    | Jean-Luc Mélenchon|Augmenter les effectifs en charge de la délinquance financière, du trafic d'êtres humains et du démantèlement des réseaux mafieux et doubler les effectifs de la police technique et scientifique.|0||Programme|IFRAP|2022-03-31|2022-03-31
1257| Intérieur, Défense & Justice|    Sécurité intérieure, police & terrorisme    | Jean-Luc Mélenchon|Intégrer au service public certaines fonctions de sécurité aujourd’hui privées.|0||Programme|IFRAP|2022-03-31|2022-03-31
1258| Intérieur, Défense & Justice|    Sécurité intérieure, police & terrorisme    | Jean-Luc Mélenchon|Interdire dans la loi tout usage des technologies de reconnaissance faciale dans les espaces et établissements publics, ainsi que leur expérimentation.|0||Programme|IFRAP|2022-03-31|2022-03-31
1259| Intérieur, Défense & Justice|    Sécurité intérieure, police & terrorisme    | Jean-Luc Mélenchon|Procéder à l'évaluation des résultats des lois déjà adoptées et revenir sur les dispositions liberticides qui ont instauré un état d'urgence permanent.|0||Programme|IFRAP|2022-03-31|2022-03-31
1260| Intérieur, Défense & Justice|    Sécurité intérieure, police & terrorisme    | Jean-Luc Mélenchon|Abroger les lois sécuritaires inefficaces et renforcer les logiques de prévention.|0||Programme|IFRAP|2022-03-31|2022-03-31
1261| Intérieur, Défense & Justice|    Sécurité intérieure, police & terrorisme    | Jean-Luc Mélenchon|"Interdire les tasers, les grenades de désencerclement, les flash-balls et les LBD 40 pour favoriser la désescalade des affrontements. Interdire les techniques d'immobilisations létales ou la technique de la ""nasse"". "|0||Programme|IFRAP|2022-03-31|2022-03-31
1262| Intérieur, Défense & Justice|    Sécurité intérieure, police & terrorisme    | Jean-Luc Mélenchon|Refonder l’IGPN (Inspection générale de la Police nationale) pour la rendre impartiale dans le traitement des litiges.|0||Programme|IFRAP|2022-03-31|2022-03-31
1263| Intérieur, Défense & Justice|    Sécurité intérieure, police & terrorisme    | Jean-Luc Mélenchon|Titulariser et former les adjoints de sécurité qui le souhaitent et porter à deux ans la formation des élèves gardiens de la paix. Réouvrir des écoles nationales pour les activités de polices.|0||Programme|IFRAP|2022-03-31|2022-03-31
1264| Intérieur, Défense & Justice|    Sécurité intérieure, police & terrorisme    | Jean-Luc Mélenchon|En finir avec la politique du chiffre et les primes aux résultats.|0||Programme|IFRAP|2022-03-31|2022-03-31
1265| Intérieur, Défense & Justice|    Sécurité intérieure, police & terrorisme    | Jean-Luc Mélenchon|Construire de nouveaux centres d'activités de police de proximité.|0||Programme|IFRAP|2022-03-31|2022-03-31
1266| Intérieur, Défense & Justice|    Sécurité intérieure, police & terrorisme    | Jean-Luc Mélenchon|Intégrer les effectifs de police municipale à la nouvelle police de proximité et la placer sous l'autorité fonctionnelle du maire et l'autorité hiérarchique du préfet.|0||Programme|IFRAP|2022-03-31|2022-03-31
1267| Intérieur, Défense & Justice|    Sécurité intérieure, police & terrorisme    | Jean-Luc Mélenchon|Rétablir le code de déontologie de la police de 1936.|0||Programme|IFRAP|2022-03-31|2022-03-31
1268| Intérieur, Défense & Justice|    Sécurité intérieure, police & terrorisme    | Jean-Luc Mélenchon|"Créer une commission ""Vérité et Justice"" sur les violences policières."|0||Programme|IFRAP|2022-03-31|2022-03-31
1269| Intérieur, Défense & Justice|    Sécurité intérieure, police & terrorisme    | Jean-Luc Mélenchon|Supprimer l'Inspection générale de la Police nationale et de la Gendarmerie nationale pour les remplacer par une autorité indépendance incluant des magistrats, des universitaires, des citoyens, rattachée au Défenseur des droits. |0||Programme|IFRAP|2022-03-31|2022-03-31
1270| Intérieur, Défense & Justice|    Sécurité intérieure, police & terrorisme    | Philippe  Poutou |Désarmement de la Police en contact avec la population.|0||Programme|IFRAP|2022-03-31|2022-03-31
1271| Intérieur, Défense & Justice|    Sécurité intérieure, police & terrorisme    | Philippe  Poutou |Interdiction des armes offensives (Flash-Ball, LBD, Taser, grenades de désencerclement...).|0||Programme|IFRAP|2022-03-31|2022-03-31
1272| Intérieur, Défense & Justice|    Sécurité intérieure, police & terrorisme    | Philippe  Poutou |Dissolution des corps spéciaux de répression (BAC et BRAV-M).|0||Programme|IFRAP|2022-03-31|2022-03-31
1273| Intérieur, Défense & Justice|    Sécurité intérieure, police & terrorisme    | Valérie Pécresse|Augmenter le budget de la sécurité à 2% du PIB.|0||Programme|IFRAP|2022-03-31|2022-03-31
1274| Intérieur, Défense & Justice|    Sécurité intérieure, police & terrorisme    | Valérie Pécresse|Consacrer 5 milliards à l’équipement matériel et informatique de nos forces de l’ordre aujourd’hui démunies et modifierai la loi pour leur permettre d’utiliser les technologies de maintien de l’ordre et d’enquête les plus performantes (police scientifique et technique, drones, etc.).|0||Programme|IFRAP|2022-03-31|2022-03-31
1275| Intérieur, Défense & Justice|    Sécurité intérieure, police & terrorisme    | Valérie Pécresse|Faire de la radicalisation un motif de licenciement, pour cause réelle et sérieuse, dans le privé comme dans le public.|0||Programme|IFRAP|2022-03-31|2022-03-31
1276| Intérieur, Défense & Justice|    Sécurité intérieure, police & terrorisme    | Valérie Pécresse|Instaurer des brigades coup de poing dans les quartiers sensibles qui sont des zones de non-droit avec plus d’effectifs de police, de cyber police, de gendarmes, de militaires, de brigade fiscale, etc.|0||Programme|IFRAP|2022-03-31|2022-03-31
1277| Intérieur, Défense & Justice|    Sécurité intérieure, police & terrorisme    | Valérie Pécresse|Expulser pour menace à l’ordre public tous les étrangers dont le comportement participe de l’islamisme radical et qui sont inscrits dans les fichiers de l’antiterrorisme.|0||Programme|IFRAP|2022-03-31|2022-03-31
1278| Intérieur, Défense & Justice|    Sécurité intérieure, police & terrorisme    | Valérie Pécresse|Fermer toute mosquée où un prédicateur tient un discours hostile à la France et aux valeurs de la République.|0||Programme|IFRAP|2022-03-31|2022-03-31
1279| Intérieur, Défense & Justice|    Sécurité intérieure, police & terrorisme    | Valérie Pécresse|Utiliser la reconnaissance faciale à l’entrée des transports en commun en croisant ses résultats avec les fichiers antiterroristes pour mieux repérer les personnes recherchées.|0||Programme|IFRAP|2022-03-31|2022-03-31
